{
  "vertical": "dental",
  "displayName": "Dental Practice",
  "baseConfidence": 40.0,
  "maxConfidence": 95.0,
  "dimensions": [
    {
      "name": "FinancialHealth",
      "displayName": "Financial Health",
      "weight": 0.25,
      "thresholds": { "strong": 75, "acceptable": 50, "weak": 25 },
      "kpis": [
        { "name": "AnnualRevenue", "displayName": "Annual Revenue", "unit": "USD", "category": "Revenue" },
        { "name": "OverheadRatio", "displayName": "Overhead Ratio", "unit": "%", "category": "Revenue" },
        { "name": "CollectionsRate", "displayName": "Collections Rate", "unit": "%", "category": "Revenue" },
        { "name": "ProfitMargin", "displayName": "Profit Margin", "unit": "%", "category": "Revenue" },
        { "name": "RevenuePerProvider", "displayName": "Revenue Per Provider", "unit": "USD", "category": "Revenue" }
      ]
    },
    {
      "name": "OwnerRisk",
      "displayName": "Owner / Key-Person Risk",
      "weight": 0.20,
      "thresholds": { "strong": 75, "acceptable": 50, "weak": 25 },
      "kpis": [
        { "name": "OwnerProductionPct", "displayName": "Owner Production %", "unit": "%", "category": "OwnerProduction" },
        { "name": "ProviderCount", "displayName": "Provider Count", "unit": "count", "category": "StaffCount" },
        { "name": "SuccessionPlanExists", "displayName": "Succession Plan", "unit": "bool", "category": "OwnerProduction" },
        { "name": "KeyPersonDependency", "displayName": "Key-Person Dependency Score", "unit": "score", "category": "OwnerProduction" }
      ]
    },
    {
      "name": "Operations",
      "displayName": "Operations",
      "weight": 0.20,
      "thresholds": { "strong": 75, "acceptable": 50, "weak": 25 },
      "kpis": [
        { "name": "ChairUtilization", "displayName": "Chair Utilization", "unit": "%", "category": "Utilization" },
        { "name": "HygieneDaysPerWeek", "displayName": "Hygiene Days / Week", "unit": "days", "category": "Utilization" },
        { "name": "NewPatientsPerMonth", "displayName": "New Patients / Month", "unit": "count", "category": "ClientVolume" },
        { "name": "StaffToProviderRatio", "displayName": "Staff to Provider Ratio", "unit": "ratio", "category": "StaffCount" },
        { "name": "TreatmentAcceptanceRate", "displayName": "Treatment Acceptance Rate", "unit": "%", "category": "Utilization" }
      ]
    },
    {
      "name": "ClientBase",
      "displayName": "Client Base",
      "weight": 0.15,
      "thresholds": { "strong": 75, "acceptable": 50, "weak": 25 },
      "kpis": [
        { "name": "ActivePatientCount", "displayName": "Active Patients", "unit": "count", "category": "ClientVolume" },
        { "name": "PatientRetentionRate", "displayName": "Patient Retention Rate", "unit": "%", "category": "ClientVolume" },
        { "name": "OnlineRating", "displayName": "Online Rating", "unit": "stars", "category": "ClientVolume" },
        { "name": "ReviewCount", "displayName": "Review Count", "unit": "count", "category": "ClientVolume" }
      ]
    },
    {
      "name": "RevenueDiversification",
      "displayName": "Revenue Diversification",
      "weight": 0.10,
      "thresholds": { "strong": 75, "acceptable": 50, "weak": 25 },
      "kpis": [
        { "name": "InsuranceMixPct", "displayName": "Insurance Mix %", "unit": "%", "category": "RevenueMix" },
        { "name": "FeeForServicePct", "displayName": "Fee-for-Service %", "unit": "%", "category": "RevenueMix" },
        { "name": "SpecialtyServicePct", "displayName": "Specialty Service Revenue %", "unit": "%", "category": "RevenueMix" },
        { "name": "TopPayerConcentration", "displayName": "Top Payer Concentration", "unit": "%", "category": "RevenueMix" }
      ]
    },
    {
      "name": "MarketPosition",
      "displayName": "Market Position",
      "weight": 0.10,
      "thresholds": { "strong": 75, "acceptable": 50, "weak": 25 },
      "kpis": [
        { "name": "PractitionerDensity", "displayName": "Dentists per 100K Pop", "unit": "ratio", "category": "RevenueMix" },
        { "name": "CompetitorCount", "displayName": "Competitors in Area", "unit": "count", "category": "RevenueMix" },
        { "name": "DsoPresence", "displayName": "DSO Presence", "unit": "bool", "category": "RevenueMix" },
        { "name": "PopulationGrowthRate", "displayName": "Population Growth Rate", "unit": "%", "category": "RevenueMix" }
      ]
    }
  ],
  "contributionCategories": [
    {
      "category": "Revenue",
      "dimension": "FinancialHealth",
      "confidenceWeight": 0.15,
      "displayName": "Revenue & Financial Data",
      "fields": [
        { "name": "annualRevenue", "label": "Annual Revenue", "type": "currency", "confidenceWeight": 0.05, "validation": { "min": 0, "max": 100000000, "required": true } },
        { "name": "overheadRatio", "label": "Overhead Ratio (%)", "type": "percentage", "confidenceWeight": 0.03, "validation": { "min": 0, "max": 100, "required": false } },
        { "name": "collectionsRate", "label": "Collections Rate (%)", "type": "percentage", "confidenceWeight": 0.03, "validation": { "min": 0, "max": 100, "required": false } },
        { "name": "profitMargin", "label": "Profit Margin (%)", "type": "percentage", "confidenceWeight": 0.02, "validation": { "min": -100, "max": 100, "required": false } },
        { "name": "revenuePerProvider", "label": "Revenue Per Provider", "type": "currency", "confidenceWeight": 0.02, "validation": { "min": 0, "max": 10000000, "required": false } }
      ]
    },
    {
      "category": "StaffCount",
      "dimension": "Operations",
      "confidenceWeight": 0.10,
      "displayName": "Staffing & Provider Data",
      "fields": [
        { "name": "totalProviders", "label": "Total Providers", "type": "integer", "confidenceWeight": 0.04, "validation": { "min": 1, "max": 500, "required": true } },
        { "name": "hygienists", "label": "Hygienists", "type": "integer", "confidenceWeight": 0.02, "validation": { "min": 0, "max": 200, "required": false } },
        { "name": "assistants", "label": "Dental Assistants", "type": "integer", "confidenceWeight": 0.02, "validation": { "min": 0, "max": 200, "required": false } },
        { "name": "frontDesk", "label": "Front Desk Staff", "type": "integer", "confidenceWeight": 0.01, "validation": { "min": 0, "max": 100, "required": false } },
        { "name": "officeManagers", "label": "Office Managers", "type": "integer", "confidenceWeight": 0.01, "validation": { "min": 0, "max": 50, "required": false } }
      ]
    },
    {
      "category": "Utilization",
      "dimension": "Operations",
      "confidenceWeight": 0.12,
      "displayName": "Utilization & Capacity Data",
      "fields": [
        { "name": "chairUtilization", "label": "Chair Utilization (%)", "type": "percentage", "confidenceWeight": 0.04, "validation": { "min": 0, "max": 100, "required": false } },
        { "name": "hygieneDaysPerWeek", "label": "Hygiene Days / Week", "type": "decimal", "confidenceWeight": 0.03, "validation": { "min": 0, "max": 7, "required": false } },
        { "name": "operatories", "label": "Number of Operatories", "type": "integer", "confidenceWeight": 0.03, "validation": { "min": 1, "max": 100, "required": false } },
        { "name": "treatmentAcceptanceRate", "label": "Treatment Acceptance Rate (%)", "type": "percentage", "confidenceWeight": 0.02, "validation": { "min": 0, "max": 100, "required": false } }
      ]
    },
    {
      "category": "ClientVolume",
      "dimension": "ClientBase",
      "confidenceWeight": 0.10,
      "displayName": "Patient Volume Data",
      "fields": [
        { "name": "activePatientCount", "label": "Active Patients", "type": "integer", "confidenceWeight": 0.04, "validation": { "min": 0, "max": 100000, "required": true } },
        { "name": "newPatientsPerMonth", "label": "New Patients / Month", "type": "integer", "confidenceWeight": 0.03, "validation": { "min": 0, "max": 5000, "required": false } },
        { "name": "patientRetentionRate", "label": "Patient Retention Rate (%)", "type": "percentage", "confidenceWeight": 0.02, "validation": { "min": 0, "max": 100, "required": false } },
        { "name": "onlineRating", "label": "Online Rating (stars)", "type": "decimal", "confidenceWeight": 0.01, "validation": { "min": 0, "max": 5, "required": false } }
      ]
    },
    {
      "category": "RevenueMix",
      "dimension": "RevenueDiversification",
      "confidenceWeight": 0.08,
      "displayName": "Revenue Mix Data",
      "fields": [
        { "name": "insuranceMixPct", "label": "Insurance Revenue (%)", "type": "percentage", "confidenceWeight": 0.02, "validation": { "min": 0, "max": 100, "required": false } },
        { "name": "feeForServicePct", "label": "Fee-for-Service (%)", "type": "percentage", "confidenceWeight": 0.02, "validation": { "min": 0, "max": 100, "required": false } },
        { "name": "specialtyServicePct", "label": "Specialty Service Revenue (%)", "type": "percentage", "confidenceWeight": 0.02, "validation": { "min": 0, "max": 100, "required": false } },
        { "name": "topPayerConcentration", "label": "Top Payer Concentration (%)", "type": "percentage", "confidenceWeight": 0.02, "validation": { "min": 0, "max": 100, "required": false } }
      ]
    },
    {
      "category": "OwnerProduction",
      "dimension": "OwnerRisk",
      "confidenceWeight": 0.12,
      "displayName": "Owner Production & Risk Data",
      "fields": [
        { "name": "ownerProductionPct", "label": "Owner Production (%)", "type": "percentage", "confidenceWeight": 0.05, "validation": { "min": 0, "max": 100, "required": true } },
        { "name": "successionPlanExists", "label": "Has Succession Plan", "type": "boolean", "confidenceWeight": 0.03, "validation": { "required": false } },
        { "name": "ownerAge", "label": "Owner Age", "type": "integer", "confidenceWeight": 0.02, "validation": { "min": 20, "max": 100, "required": false } },